{
  "specVersion": "0.0-draft",
  "proposalId": "proposal_fixture_peer01",
  "source": {
    "taskId": "task_fixture_sender",
    "incarnationId": "inc_fixture_sender01"
  },
  "target": {
    "taskId": "task_fixture_target",
    "incarnationId": "inc_fixture_target01"
  },
  "relationshipType": "peer",
  "requestedIntents": ["suggest"],
  "requestedDeliveryModes": ["checkpoint-offer"],
  "requestedSummaryVisibility": "coordination",
  "reason": "The tasks share a declared dependency boundary.",
  "proposedBy": {
    "actorType": "agent",
    "task": {
      "taskId": "task_fixture_sender",
      "incarnationId": "inc_fixture_sender01"
    }
  },
  "createdAt": "2026-08-20T09:00:00Z",
  "expiresAt": "2026-08-20T09:10:00Z"
}
